id,translate,translate_description,source
1449,arsenal,"facility for storage, maintenance and repair of weapons",AI
1450,aspect,way of viewing; point of view,AI
1451,asylum,accommodation for people without their own home,AI
1452,asylum seeker,person seeking admission and protection,AI
1453,processing,working through things that have accumulated over time,AI
1454,stay,being present; remaining somewhere,AI
1455,request,urgent request to do something,AI
1456,emergence,emergence of a phenomenon,AI
1457,condition,special condition that must be met to obtain permission,AI
1458,impact,"violent, audible collision",AI
1459,appeal,public call to do or refrain from something,AI
1460,inscription,short written notice or label on an object,AI
1461,upswing,"more momentum, lift, progress",AI
1462,listing,listing of data,AI
1463,spread,spreading or expansion of something,AI
1464,failure,failure or loss of a system or its parts,AI
1465,information,an item of information; a statement about something,AI
1466,exclusion,excluding people or things from a space or event; keeping someone or something away,AI
1467,call for bids,written announcement offering something and inviting applications or participation,AI
1468,exit,act of leaving something,AI
1469,broadcast,transmission of a radio or television program,AI
1470,expansion,expansion or enlargement,AI
1471,time-out,short interruption of a game,AI
1472,female driver,female person who drives a car,AI
1473,automotive industry,industry producing and servicing motor vehicles,AI
1474,bathing,the act or concept of immersing something in a liquid and taking a bath,AI
1475,rail route,railway line connecting two places,AI
1476,abdomen,front part of the torso between diaphragm and pelvis,AI
1477,beach,"long, flat sandy or gravelly strip of land jutting into water",AI
1478,pelvis,body section below the abdomen and above the legs,AI
1479,service,service performed by one person for another,AI
1480,termination,ending or stopping a process or activity,AI
1481,questioning,asking questions to witnesses or suspects,AI
1482,liberation,ending of captivity or detention,AI
1483,assertion,statement presented as fact without proof or justification,AI
1484,disability,physical or mental impairment affecting participation in society,AI
1485,passenger,person riding in the seat next to the driver,AI
1486,leg,limb for walking and standing,AI
1487,confession,binding statement that something attributed is indeed the case,AI
1488,workforce,totality of employees in a company,AI
1489,insult,injury to another's personal honor,AI
1490,lighting,illumination of a room or object with artificial light,AI
1491,popularity,being popular,AI
1492,reward,recognition or recompense for something done,AI
1493,observation,"focused, conscious examination and perception",AI
1494,calculation,solving formulas,AI
1495,rescue,"rescue of people in distress, injured, or dead",AI
1496,crew,"all crew members on a ship, aircraft, or similar",AI
1497,complaint,statement about an unwanted situation or misconduct,AI
1498,special feature,special characteristic of something,AI
1499,applicant,person who applies,AI
1500,application,act of applying for something,AI
