id,translate,translate_description,source
6436,production series,products made in the same design,AI
6437,construction fence,temporary barrier securing a construction site,AI
6438,fertilization,union of male and female cells leading to reproduction,AI
6439,companion,person who accompanies,AI
6440,pardon,remission or reduction of a legally imposed sentence; pardon,AI
6441,withdrawal,"Austrian: withdrawal of a sum of money, the entire capital",AI
6442,aftertaste,secondary taste,AI
6443,settlement,ending of a conflict or dispute,AI
6444,assessor,member of a committee who is not the chair,AI
6445,public announcement,public notice,AI
6446,acquaintance,beginning of a contact or personal relationship,AI
6447,claim letter,letter in which someone admits responsibility,AI
6448,assignment,assignment or allocation of a value; configuration,AI
6449,benefit concert,concert whose proceeds support those in need,AI
6450,gasoline car,vehicle with a gasoline engine,AI
6451,mountain village,village in the mountains,AI
6452,vocational training,training to practice a profession,AI
6453,condition,nature or state of something,AI
6454,broom,cleaning tool with bristles and a handle,AI
6455,inventory count,"physical inventory by counting, measuring, or weighing",AI
6456,cutlery,utensils for eating,AI
6457,female visitor,female person who comes to visit,AI
6458,stress,emphasis of a syllable by stronger airflow or higher pitch,AI
6459,female caregiver,"female person who accompanies, cares for, or helps others",AI
6460,operating profit,profit of an operation,AI
6461,armament,equipping with weapons,AI
6462,preservation,keeping something or a state intact,AI
6463,Bibi,female given name or nickname,AI
6464,bidder,person who makes a bid,AI
6465,picture book,book with many pictures and little text,AI
6466,embarrassment,situation causing loss of face,AI
6467,brass band,music group playing wind instruments,AI
6468,field of view,area one can see,AI
6469,blonde woman,female person with blond hair,AI
6470,body,"body, usually well-shaped and muscular",AI
6471,bulwark,"fortification, formerly built of planks",AI
6472,tabloid newspaper,newspaper with very flashy presentation,AI
6473,pit stop,short stop of a race car in the pits,AI
6474,fire source,place where a fire starts,AI
6475,fuel,material that can be burned and used to produce energy,AI
6476,accounting,organizational unit recording business transactions,AI
6477,kiosk,small sales booth,AI
6478,Federal Ministry of Finance,federal finance ministry,AI
6479,federal defense minister,head of the defense ministry,AI
6480,female federal chair,female leader at federal level,AI
6481,Federal Ministry for Economic Affairs,ministry responsible for economic development,AI
6482,castle ruin,ruin of a castle,AI
6483,canyon,deep narrow gorge,AI
6484,chemical conglomerate,large company producing synthetic products,AI
6485,choir director,person who directs a choir,AI
6486,cocktail,alcoholic mixed drink,AI
6487,Cox,winter apple with reddish-yellow peel,AI
6488,dancing,dancing; dance event,AI
6489,dike,dam along waters to protect from floods,AI
6490,offense,violation of criminal law,AI
6491,demonstration march,group moving in public to support its goals,AI
6492,landfill,place where waste is stored,AI
6493,deportation,forcible relocation of people to a distant place,AI
6494,interpretation,attempt to understand the deeper meaning of something,AI
6495,diagonal,slanted line or arrangement on such a line,AI
6496,servant,dependent worker performing household duties,AI
6497,service sector,sector of the economy providing services,AI
6498,interpreter,person who translates spoken text,AI
6499,double role,two roles at the same time,AI
6500,drama,exciting situation,AI
