id,translate,translate_description,source
10001,боб,растение (или его часть) различных бобовых,AI
10002,бомбардировка,продолжительная атака тяжелой артиллерией или с воздуха бомбами,AI
10003,ботаника,наука о растениях,AI
10004,желтая пресса,"малосерьезная пресса, часто использующая искаженные и клеветнические сообщения и апеллирующая к низким инстинктам читателей",AI
10005,боксерский поединок,спортивное противостояние; бой двух боксеров,AI
10006,гнедая лошадь,коричневая лошадь,AI
10007,каша,густая вареная пища,AI
10008,переписка,обмен письмами,AI
10009,кровное родство,кровное родство нескольких семей одной породы,AI
10010,Брунн,топоним; название нескольких мест,AI
10011,буддизм,"одна из мировых религий, учение Будды",AI
10012,федеральное министерство юстиции,министерство юстиции федерации,AI
10013,Бургундия,регион во Франции,AI
10014,поездка на автобусе,поездка на автобусе,AI
10015,«баттерфляй»,разведение ног в прыжке в стороны,AI
10016,кафетерий,кафе самообслуживания,AI
10017,карикатура,"однопанельный рисунок, сатирический, комический или политический",AI
10018,хром,"химический элемент с порядковым номером 24, относящийся к переходным металлам",AI
10019,претензия,правовое требование на что‑либо,AI
10020,вельвет,"ребристая ткань, обычно из хлопка",AI
10021,угловой,угол; в спорте — угловой удар,AI
10022,кутьюр,"высокая мода, задающее тон портновское искусство",AI
10023,такса,"небольшая собака, традиционно используемая для охоты",AI
10024,донос,(часто анонимное и/или ложное) донесение,AI
10025,отдел,"подразделение, сфера деятельности ведомства",AI
10026,укроп,кухонная пряная трава,AI
10027,округ,ограниченная область,AI
10028,преподавательница,преподаватель (особенно в вузе),AI
10029,дрессировка,"обучение животных, особенно лошадей и собак",AI
10030,наркодилер,"человек, покупающий и продающий наркотики",AI
10031,злоупотребление наркотиками,неприемлемое потребление наркотиков,AI
10032,просмотр,контроль/чтение печатного издания,AI
10033,почетное место,"место, занятие которого является честью",AI
10034,доля собственного капитала,отношение собственного капитала к сумме баланса,AI
10035,собственное производство,собственная продукция,AI
10036,сфера влияния,"область, на которую можно воздействовать",AI
10037,вестибюль,большое помещение в зоне входа здания,AI
10038,вклад,"то, что внесено или вложено",AI
10039,срок подачи,"момент, после которого отправления больше не принимаются",AI
10040,страна иммиграции,"страна, куда массово переселяются люди, животные или растения",AI
10041,жительница,"женщина, проживающая в определенном месте или регионе",AI
10042,железнодорожная компания,"компания, управляющая железной дорогой",AI
10043,хоккеист,"человек, играющий в хоккей",AI
10044,ледовый дворец,зал с ледовой площадкой для ледовых видов спорта,AI
10045,эмблема,"символ, знак",AI
10046,эмиграция,постоянный выезд в другую страну,AI
10047,финальный забег,последний решающий забег соревнований,AI
10048,энергетический рынок,совокупность спроса и предложения энергии,AI
10049,внук или внучка,ребенок сына или дочери,AI
10050,анклав,"часть чужой территории, окруженная собственными землями",AI
10051,фермент,"белок‑катализатор, ускоряющий химические реакции",AI
10052,клубника,"съедобный красный плод, растущий на низких кустиках",AI
10053,обмен опытом,обмен опытом,AI
10054,секрет успеха,секрет достижения успеха,AI
10055,успешный курс,курс с успехом,AI
10056,наставление,"действие, побуждающее к чему‑то или удерживающее от чего‑то",AI
10057,дополнительные выборы,последующие выборы,AI
10058,первенец,первый экземпляр или первый ребенок,AI
10059,трудовая жизнь,период трудовой деятельности,AI
10060,заклятый соперник,самый сильный или злейший соперник,AI
10061,казнь,исполнение смертного приговора,AI
10062,экспозиция,"концепция, план, обзор для более подробного изложения",AI
10063,эксцесс,"чрезмерное, безмерное преувеличение",AI
10064,профильный комитет,комитет по профильным темам,AI
10065,профессиональная литература,совокупность публикаций для специалистов,AI
10066,факел,"переносной предмет с горючим составом на конце, дающий яркое пламя",AI
10067,соколятник,"человек, тренирующий хищных птиц для охоты",AI
10068,семейное пособие,финансовая помощь семьям,AI
10069,министерство семьи,министерство по делам семьи,AI
10070,краситель,"химическое соединение, используемое для окрашивания материалов",AI
10071,волокно,нить из ткани,AI
10072,курорт,"место, где проводят отпуск",AI
10073,поросенок,детеныш домашней свиньи,AI
10074,телешоу,развлекательная передача,AI
10075,тяга к дальним странам,"тоска по дальним странам, жажда путешествий",AI
10076,сборник в честь,публикация с вкладом разных авторов в честь юбилея,AI
10077,управляющий филиалом,"человек, руководящий филиалом",AI
10078,киноиндустрия,отрасль по производству и распространению фильмов,AI
10079,кинотеатр,учреждение для публичного показа фильмов,AI
10080,финансовый эксперт,"человек, хорошо разбирающийся в финансах",AI
10081,финансовый институт,предприятие для денежных операций,AI
10082,финансовый план,план доходов и расходов,AI
10083,финансовая ситуация,текущая финансовая обстановка,AI
10084,группа компаний,группа связанных предприятий,AI
10085,плоская крыша,кровля с малым уклоном 2–20°,AI
10086,фламенко,ритмичный андалузский сольный или парный танец,AI
10087,Фландрия,регион на севере Бельгии,AI
10088,спорткар,быстрый спортивный автомобиль,AI
10089,штамп,шаблонная фраза или пустые слова,AI
10090,листовка,небольшой листок с информацией или рекламой,AI
10091,авиакомпания,"компания, выполняющая авиаперевозки",AI
10092,авиапутешествие,путешествие на самолете,AI
10093,производитель самолетов,"компания, которая разрабатывает, строит и продает самолеты",AI
10094,волна наводнения,движущаяся зона повышенного уровня воды,AI
10095,перечень требований,список требований,AI
10096,фрагмент,"обломок, часть чего‑то",AI
10097,председательство фракции,руководство фракцией,AI
10098,образ женщины,впечатление или мнение о женщинах,AI
10099,женская политика,политические меры по защите интересов женщин,AI
10100,бесплатное пиво,"пиво, разливаемое бесплатно",AI
10101,вольноотпускная грамота,документ о разрешении или освобождении от запрета/крепостной зависимости,AI
10102,лишение свободы,ограничение личной свободы по решению властей или суда,AI
10103,ксенофобия,негативное или враждебное отношение к иностранцам,AI
10104,заимствованное слово,слово из другого языка с минимальной адаптацией,AI
10105,мирная инициатива,инициатива по установлению мира и началу переговоров,AI
10106,политика мира,"политика, направленная на достижение/сохранение мира",AI
10107,миротворчество,меры по поддержанию мира,AI
10108,корм,"то, чем кормят животных",AI
10109,галерист,владелец художественной галереи,AI
10110,гальюнная фигура,деревянная фигура на носу парусника,AI
10111,гамма,название третьей греческой буквы,AI
10112,садоводство,"интенсивное выращивание цветов, фруктов и овощей",AI
10113,город‑сад,город с большим количеством садов и зелёных зон,AI
10114,цена на газ,денежная сумма за газ на рынке,AI
10115,принимающая семья,"семья, принимающая гостя на определенный срок",AI
10116,гостевая колонка,комментарий приглашенного автора,AI
10117,кляча,плохая лошадь,AI
10118,манера,характерное поведение,AI
10119,начальник разведки,руководитель спецслужбы,AI
10120,разведчик,сотрудник разведслужбы,AI
10121,тайная полиция,тайно действующая полиция с особыми полномочиями,AI
10122,захватчик заложников,"человек, лишающий других свободы",AI
10123,банкомат,автомат выдачи наличных,AI
10124,денежная масса,вся масса денег в обращении,AI
10125,муниципальное объединение,союз административных единиц,AI
10126,генеральный инспектор,самый высокий по рангу солдат Бундесвера,AI
10127,генеральный консул,"старший консул, руководитель генерального консульства",AI
10128,поколенческий договор,"соглашение, по которому работающие финансируют пенсии старших",AI
10129,товарищ,"человек, сопровождающий другого в делах или жизни",AI
10130,геометрия,наука о свойствах фигур на плоскости и в пространстве,AI
10131,юрисдикция,право осуществлять правосудие,AI
10132,полное собрание,полное произведение автора/художника,AI
10133,призрак,дух; часто пугающее сверхъестественное существо,AI
10134,дизайнер,"человек, который что‑то оформляет",AI
10135,реформа здравоохранения,крупная законодательная перестройка системы здравоохранения,AI
10136,охрана здоровья,"меры и правила, защищающие здоровье людей",AI
10137,восстановление,путь к возвращению состояния здоровья,AI
10138,зона прибыли,область с прибылью,AI
10139,дерганье,долгое резкое таскание,AI
10140,жираф,"крупное травоядное с длинной шеей, обитающее в африканских саваннах",AI
10141,уравнение,"формула, утверждающая равенство двух значений",AI
10142,жар,"тлеющий материал, горение без пламени",AI
10143,грамматика,языковые знания с правилами и лексикой,AI
10144,грифон,мифическое существо с головой орла и телом льва,AI
10145,грот,"пещера, обычно короткая, иногда искусственная",AI
10146,землевладелец,"человек, имеющий земельную собственность",AI
10147,земельный реестр,реестр прав и фактов по недвижимости,AI
10148,линия поля,"линия в спортивном поле, ограничивающая его",AI
10149,ключевая проблема,центральная основная проблема,AI
10150,принципиальный вопрос,вопрос принципиального значения,AI
10151,основа,исходный набор доступных вещей,AI
10152,полумесяц,"луна, освещенная наполовину",AI
10153,турнир в зале,"соревнование, проходящее в помещении",AI
10154,хомяк,сумеречный грызун семейства хомяковых,AI
10155,ручная граната,"металлический корпус со взрывчаткой, бросаемый рукой",AI
10156,перчатка,одежда для защиты или согрева руки и пальцев,AI
10157,конопля,род цветковых растений Cannabis,AI
10158,ангар,большой крытый зал для хранения и ремонта летательных аппаратов,AI
10159,Хаслингер,фамилия,AI
10160,главная аттракция,самая впечатляющая из нескольких,AI
10161,аттестат Hauptschule,школьный аттестат о завершении основной школы,AI
10162,главное произведение,важнейшая работа автора,AI
10163,визит на дом,посещение клиента/пациента на дому,AI
10164,бюджетные дебаты,обмен мнениями в парламенте о бюджете,AI
10165,домработница,"человек, помогающий по дому",AI
10166,домохозяин,"мужчина, ведущий домашнее хозяйство",AI
10167,авария,"крупное повреждение, особенно в транспорте",AI
10168,слушания,опрос и заслушивание экспертов комиссией,AI
10169,гегемония,доминирующее положение и власть,AI
10170,гектолитр,единица объема: 100 литров,AI
10171,понижение,действие по уменьшению,AI
10172,господский дом,дом владельца сельхозпоместья,AI
10173,акция помощи,мероприятие с целью помочь,AI
10174,скоростной поезд,"поезд, идущий более 270 км/ч",AI
10175,экономический бум,фаза высокого экономического роста,AI
10176,высокое напряжение,электрическое напряжение свыше 1000 вольт,AI
10177,высокие технологии,очень передовая техника,AI
10178,придворная свита,совокупность служащих и приближенных монарха,AI
10179,полость,пустое или заполненное жидкостью или газом пространство внутри твердого тела,AI
10180,деревянный дом,"дом, полностью построенный из древесины",AI
10181,Хорнунг,"старое название февраля, второго месяца года",AI
10182,собачий помет,"фекалии, происходящие от собаки",AI
10183,идиллия,"состояние простой, мирной жизни",AI
10184,пыл,сильная самоотдача чувству или делу,AI
10185,индивидуализация,тенденция уделять внимание свободе и самостоятельности личности,AI
10186,информационные технологии,наука и область информационной техники,AI
10187,иннунг,объединение ремесленников одного ремесла,AI
10188,интеллект,способность мыслить и познавать; разум,AI
10189,временной промежуток,промежуточное время,AI
10190,исламист,сторонник исламского фундаментализма,AI
10191,среднегодовое значение,"среднее, рассчитанное по значениям за год",AI
10192,перекус,легкая еда между основными приемами пищи,AI
10193,жокей,наездник на скаковой лошади,AI
10194,молодежная культура,культурные активности и стили молодежи,AI
10195,молодежный оркестр,оркестр из молодежи,AI
10196,театр для молодежи,театр для подростков,AI
10197,камерная пьеса,пьеса для небольшой сцены,AI
10198,соревновательное голосование,"голосование, где соревнуются два примерно равных кандидата",AI
10199,боевое применение,участие в боевых действиях,AI
10200,список кандидатов,"перечень людей, выдвигаемых в кандидаты",AI
10201,кандидатура на канцлера,выдвижение на пост канцлера,AI
10202,морковь,"округлая, ранняя разновидность моркови",AI
10203,телега,простое прочное средство передвижения на колесах,AI
10204,зона катастрофы,"территория, где произошла крупная катастрофа",AI
10205,печенье,сладкая плоская выпечка,AI
10206,ключевой вопрос,самый важный вопрос,AI
10207,Кигали,столица Руанды,AI
10208,ясли,учреждение для детей младше 3 лет,AI
10209,детская пора,период детства,AI
10210,Кингстон,"город, в том числе на Ямайке",AI
10211,замазка,пластичная масса для склеивания и герметизации,AI
10212,звуковая картина,общий звук; звуковой образ,AI
10213,классная поездка,многодневная поездка школьного класса,AI
10214,клей,неметаллический материал для склеивания,AI
10215,клиент,"человек, которого обслуживают или представляют",AI
10216,мальчик,ребенок мужского пола,AI
10217,корзина,корзина для переноски продуктов,AI
10218,комод,мебель с несколькими ящиками,AI
10219,презерватив,латексный чехол для защиты при половом акте,AI
10220,вероисповедание,принадлежность к определенной религии,AI
10221,курс на конфронтацию,"поведение, допускающее столкновение разных позиций",AI
10222,конгломерат,смесь или сгущение разных вещей,AI
10223,контрапункт,самостоятельная мелодическая и ритмическая линия,AI
10224,собор,церковный собор католической церкви,AI
10225,договор о сотрудничестве,договор о совместной работе,AI
10226,рост затрат,увеличение расходов,AI
10227,структура затрат,структура расходов,AI
10228,проба,небольшое количество для дегустации,AI
10229,существо,живое создание,AI
10230,кредитор,"человек или учреждение, выдающее кредиты",AI
10231,мел,мягкий белый известняк,AI
10232,председатель округа,председатель округа,AI
10233,районный совет,правление округа,AI
10234,крематорий,учреждение для кремации,AI
10235,перекрестный огонь,обстрел с нескольких сторон,AI
10236,военная служба,выполнение задач в военных действиях,AI
10237,плен,пребывание солдат в качестве военнопленных,AI
10238,противник на войне,противник в войне,AI
10239,состояние войны,"ситуация, когда стороны находятся в войне",AI
10240,главный свидетель,"свидетель, дающий показания в обмен на смягчение наказания",AI
10241,кукушка,"птица, подкладывающая яйца в чужие гнезда",AI
10242,референт по культуре,руководитель по культурным вопросам,AI
10243,конференция министров образования,встреча министров образования земель Германии,AI
10244,академия искусств,"академия, посвященная искусствам",AI
10245,арт-ярмарка,ярмарка искусства,AI
10246,муфта,"элемент, соединяющий вращающиеся части",AI
10247,руководитель курса,"человек, ведущий курс",AI
10248,уровень курса,уровень курса,AI
10249,участник курса,"человек, посещающий курс",AI
10250,падение курса,снижение курса,AI
10251,складское помещение,часть здания для хранения,AI
10252,волнение перед сценой,напряжение артиста перед выступлением,AI
