id,translate,translate_description,source
8501,заверение,обязательное обещание,AI
8502,обострение,доведение до крайности,AI
8503,содействие,"помощь, участие",AI
8504,двухлетний контракт,"договор, действующий два года",AI
8505,второй голос,"голос, которым выбирают партию",AI
8506,гном,маленькое сказочное существо,AI
8507,промежуточный отчет,отчет о промежуточном состоянии,AI
8508,промежуточный склад,место временного хранения,AI
8509,распря,"затяжная ссора, разлад",AI
8510,причастие/Тайная вечеря,"собственно «Тайная вечеря», последняя торжественная трапеза Иисуса из Назарета с двенадцатью первыми призванными учениками (апостолами)",Ilia
8511,сток,"то, что стекает",Ilia
8512,уединение,состояние уединенности/быть отдельно от других,Ilia
8513,официальное предупреждение,формальное требование одной персоны к другой впредь прекратить определенное поведение,Ilia
8514,изоляция,"отгораживание, изоляция",Ilia
8515,отталкивание,действие в начале прыжка; выполнение начала прыжка,AI
8516,воздержание,воздержанность,AI
8517,ахиллово сухожилие,"сухожилие икроножной мышцы, прикрепляющееся к пяточной кости",AI
8518,пахотная земля,"земля, пригодная для сельскохозяйственного использования",AI
8519,кровеносный сосуд,общее обозначение для всех кровеносных сосудов,AI
8520,кровопускание,удаление крови с помощью пиявок; ранее также выпускание крови,AI
8521,администратор,"управляющий, распорядитель",AI
8522,фондовый индекс,"показатель, отражающий движение выбранных курсов акций на фондовом рынке",AI
8523,алабамский язык,"язык народа Алабама на юго-востоке США, сходный с кушатта",AI
8524,албанец,гражданин Албании,AI
8525,алжирец,"человек, родившийся в Алжире",AI
8526,алкоголизм,психическая и физическая зависимость от алкоголя,AI
8527,Альпийская республика,шутливое обозначение Австрии,AI
8528,сорока,"сорока, садовая ворона",AI
8529,бывший канцлер,"канцлер, уже не находящийся в должности",AI
8530,аминь,"формула подтверждения в конце молитвы, благословения, чтения или проповеди в иудаизме, христианстве и исламе",AI
8531,амман,швейцарская должностная категория.,AI
8532,амнистия,полное или частичное освобождение от наказания,AI
8533,служебное действие,отдельный властный акт,AI
8534,анатомия,учение о строении тела,AI
8535,начало,начальная пора чего-либо,AI
8536,Андалусия,регион на юге Испании.,AI
8537,присвоение,завладение бесхозной вещью,AI
8538,приступ,внезапное сильное проявление болезни,AI
8539,сближение,"изменение, чтобы что-то стало более похожим или лучше подходило",AI
8540,зацепка,"то, что дает указание на правильность предположения",AI
8541,строитель установок,"компания, которая проектирует и строит технические установки",AI
8542,обвинение,предъявление вины,AI
8543,яблочный сок,напиток из яблочного сока,AI
8544,апостол,"один из двенадцати учеников, посланных Иисусом из Назарета на миссию",AI
8545,прошение,"заявление, прошение",AI
8546,сфера работы,"предметная область или круг задач, которыми занимается человек",AI
8547,трудовой конфликт,"организованное противостояние работников и работодателей с забастовками, демонстрациями и локаутами",AI
8548,рабочая сила,"человек, выполняющий (физический) труд",AI
8549,охрана труда,"совокупность мер и правил, защищающих работников от вреда",AI
8550,ищущая работу,"женщина, находящаяся в поиске работы",AI
8551,кабинет,комната в доме для профессиональной работы,AI
8552,договоренность,действие по достижению соглашения и его результат,AI
8553,Ассизи,город в Италии.,AI
8554,ядерное оружие,"оружие, основанное на ядерных процессах (синтез или деление)",AI
8555,ДНЯО,международный договор 1968 года о нераспространении ядерного оружия и мирном использовании атомной энергии,AI
8556,работы по строительству,"работа по созданию здания, системы или структуры",AI
8557,хранение,защита от внешних воздействий,AI
8558,оформление,внешнее оформление/вид,AI
8559,разделение,разделение на несколько частей.,AI
8560,выращивание,уход и питание еще не выросших живых существ,AI
8561,услада для глаз,"приятный, радующий взгляд вид",AI
8562,учебное предприятие,"предприятие, обучающее учеников",AI
8563,выразительность,способность выразиться эффективно.,AI
8564,изречение,"короткое важное высказывание, часто известных людей",AI
8565,ушедший,"человек, который полностью отказался от чего-то (например профессии или группы)",AI
8566,владелец автомобиля,"человек, который владеет автомобилем",AI
8567,автограф,подпись знаменитости,AI
8568,марка автомобиля,бренд автомобилей,AI
8569,Вавилон,древний город в Месопотамии.,AI
8570,плавки,"одежда для плавания или загара, надеваемая на нижнюю часть тела",AI
8571,барометр,прибор для измерения атмосферного давления,AI
8572,лесной массив,совокупность деревьев в определенной области,AI
8573,скованность,неуверенность или колебание по отношению к делу,AI
8574,командующий,"человек, имеющий власть отдавать приказы",AI
8575,крепление,действие по закреплению на объекте,AI
8576,удовлетворение,"действие, при котором выполняются желания и требования; удовлетворенность",AI
8577,топорик,короткий рубящий инструмент,AI
8578,побочный элемент,"дополнительное, но не необходимое",AI
8579,канатная дорога,транспорт для подъема на гору,AI
8580,шахта,предприятие по добыче полезных ископаемых,AI
8581,профессиональная ассоциация,объединение профессии.,AI
8582,принятие решения,"решение по вопросу, часто коллегиально",AI
8583,осознанность,состояние умственной собранности,AI
8584,денежное довольствие,вознаграждение госслужащего,AI
8585,лучшая форма,лучшая форма.,AI
8586,высшая оценка,самая желательная оценка,AI
8587,инвестиционная компания,компания для участия в капитале.,AI
8588,нищий,"нуждающийся, живущий милостыней",AI
8589,доказательная база,совокупность доказанных или отсутствующих фактов,AI
8590,районный комитет,локальный орган представления интересов граждан,AI
8591,биеннале,"выставка или смотр, проходящие раз в два года (особенно изобразительное искусство и кино)",AI
8592,бикини,раздельный купальник для женщин,AI
8593,альбом,"книга, которая в основном содержит изображения",AI
8594,портрет,изображение человека (или бога),AI
8595,образовательное предложение,"совокупность образовательных возможностей, предоставляемых, например, школой или университетом",AI
8596,сфера образования,"совокупность учреждений и организаций сообщества, которые служат образованию как приобретению знаний и навыков",AI
8597,подпись к изображению,"текст под иллюстрацией, обычно поясняющий ее",AI
8598,биогаз,"продукт анаэробного брожения органических субстратов; образующийся газ, пригодный как альтернативный источник энергии",AI
8599,биотоп,естественная среда обитания определенных растений и животных,AI
8600,груша,вид плодового дерева,AI
8601,духовой оркестр,"обычно большая группа музыкантов, играющих главным образом на духовых инструментах",AI
8602,повреждение кузова,"ущерб при ДТП, когда есть только материальные повреждения без пострадавших",AI
8603,сверло,стержневой инструмент для сверления круглых отверстий вращением,AI
8604,Ботсвана,государство на юге Африки,AI
8605,грудная клетка,"костный каркас из ребер, верхней части позвоночника и грудины, защищающий сердце и легкие",AI
8606,книжный магазин,магазин для продажи книг,AI
8607,федеральное министерство здравоохранения,высший орган здравоохранения федерации под руководством министра,AI
8608,федеральная конституция,конституция федеративного государства,AI
8609,верхний менеджмент,руководство компании,AI
8610,руководящая должность,должность верховного руководителя компании или организации,AI
8611,химикат,"химическое вещество, изготовленное в промышленности или в лаборатории",AI
8612,Химзее,озеро в Баварии,AI
8613,китаец,гражданин Китая,AI
8614,хлор,химический элемент с порядковым номером 17,AI
8615,победитель кубка,победитель кубкового турнира,AI
8616,Дакар,столица Сенегала,AI
8617,собрание делегатов,собрание делегатов,AI
8618,дурак,"человек с меньшим интеллектом или разумом, чем у большинства",AI
8619,детектив,"(обычно частный) сыщик, ищущий доказательства",AI
8620,работник,работник (австр.),AI
8621,диспут,разговор или обмен мнениями с целью убедить оппонента,AI
8622,дисквалификация,отстранение спортсмена от соревнования за нарушение правил,AI
8623,догма,"основное учение с обязательной истинностью, часто со ссылкой на откровение",AI
8624,донна,обращение/титул для некоторых итальянских дворянок,AI
8625,велосипед,велосипед (разг.),AI
8626,драматург,"человек, пишущий драмы",AI
8627,турникет,"крестообразное устройство, пропускающее людей по одному",AI
8628,понимание,понимание взаимосвязей,AI
8629,среднее значение,среднее значение измерений,AI
8630,почетный член,член с почетным статусом,AI
8631,благоговение,трепетное уважение к достоинству или величию,AI
8632,собственная инициатива,"активность, исходящая от человека или организации без внешнего толчка",AI
8633,изобретательность,наличие множества идей,AI
8634,интеграция,включение кого‑то или чего‑то в большую единицу,AI
8635,подоходный налог,налог на доходы физических лиц,AI
8636,служебный автомобиль,специально оснащенное транспортное средство для служебных операций,AI
8637,оперативная группа,группа для выполнения операции,AI
8638,возражение,формальное возражение,AI
8639,внесение,действие внесения записи,AI
8640,возражение,реакция на предложение или идею с выражением сомнений,AI
8641,одиночка,"человек сам по себе, без сопровождающих",AI
8642,индивидуальная гонка,гонка на время в велоспорте,AI
8643,айсберг,"большая масса льда, плавающая в море",AI
8644,тщеславие,чрезмерная забота о собственной совершенстве,AI
8645,освобождение,"освобождение от чего‑то, особенно от обязанности",AI
8646,экспедиция,путешествие с целью открытий,AI
8647,вознаграждение,оговоренное в договоре встречное предоставление,AI
8648,сход с рельсов,"авария, когда рельсовый транспорт сходит с пути",AI
8649,эпидемия,массовое распространение болезни в популяции,AI
8650,эпос,"объемное повествование в стихах, форма эпики",AI
8651,экип,"группа спортсменов, соревнующихся вместе",AI
8652,процент успеха,доля успешных случаев,AI
8653,мир впечатлений,мир переживаний,AI
8654,поддержка,попытка придать кому‑то больше смелости или радости,AI
8655,запасной,запасной игрок,AI
8656,удивление,"состояние, когда приходится удивляться",AI
8657,работа по найму,работа для получения средств к существованию,AI
8658,едок,"человек, который ест или любит есть",AI
8659,эстонец,гражданин Эстонии,AI
8660,чемпионка Европы,лидер Европы; победительница чемпионата Европы,AI
8661,прожиточный минимум,минимум средств для жизни,AI
8662,экспортная экономика,экономика экспорта,AI
8663,грань,ограненная грань; одна из граней драгоценного камня,AI
8664,область знаний,рабочая или научная область,AI
8665,профессиональная компетенция,профессиональная компетентность,AI
8666,профшкола,"учебное заведение, специализирующееся на определенной области",AI
8667,семейная собственность,совокупность имущества семьи,AI
8668,семейная драма,"трагическое, сложное событие в семье",AI
8669,фермер,"человек, владеющий фермой и обычно ведущий ее",AI
8670,лень,внутреннее нежелание делать трудное,AI
8671,инжир,сладкий съедобный плод инжирного дерева,AI
8672,лист инжира,лист инжирного дерева,AI
8673,скальный обломок,кусок скалы,AI
8674,феминистка,"женщина, выступающая за феминизм и права женщин",AI
8675,пятка,задняя часть стопы,AI
8676,стационарная сеть,система телефонной связи по кабелям и линиям,AI
8677,торжественная речь,праздничная речь,AI
8678,командир пожарной службы,руководитель пожарной части,AI
8679,финансовая сила,способность располагать средствами или получать их,AI
8680,финансовый рынок,"совокупность рынков, где обращаются финансовые средства",AI
8681,Финке,фамилия,AI
8682,рыбный рынок,"рынок, где продают свежую рыбу",AI
8683,мясник,"ремесленник, занимающийся забоем и подготовкой мяса",AI
8684,риск побега,"возможность, что кто‑то сбежит",AI
8685,эвакуационный путь,безопасный маршрут для эвакуации и доступа спасателей,AI
8686,управляющая компания,"компания, собирающая средства инвесторов и выпускающая паи",AI
8687,лесничество,"ведомство, отвечающее за лесное хозяйство",AI
8688,передвижение,движение вперед от точки,AI
8689,ископаемое,свидетельство прошлой жизни старше 10 000 лет,AI
8690,фотосессия,время для фотографирования,AI
8691,женское движение,"группа людей, добивающихся равноправия женщин",AI
8692,женский день,8 марта,AI
8693,фристайл,"свободный стиль, например в спорте",AI
8694,освобождение,освобождение от обязанностей,AI
8695,организация досуга,планирование досуга,AI
8696,миротворческая миссия,задача по обеспечению мира и безопасности,AI
8697,премия мира,премия за заслуги в деле мира,AI
8698,гангстер,член преступной банды,AI
8699,садовая выставка,выставка по садоводству,AI
8700,хозяин трактира,"человек, управляющий рестораном/гостиницей",AI
8701,Гебауэр,фамилия,AI
8702,дом рождения,"дом, где кто‑то родился",AI
8703,подарок на день рождения,"подарок, традиционно даримый на день рождения",AI
8704,памятный камень,"каменный блок, напоминающий о ком‑то или чем‑то",AI
8705,местность,"ландшафт, регион",AI
8706,переплетение,"то, что переплетено",AI
8707,последователи,совокупность сторонников кого‑то или чего‑то,AI
8708,контратака,атака в ответ на нападение противника,AI
8709,противоположность,другой полюс или объект с противоположными свойствами,AI
8710,эквивалент,равноценная замена,AI
8711,финансовое учреждение,компания для финансовых операций,AI
8712,совместный проект,"проект, выполняемый совместно",AI
8713,главный музыкальный директор,ведущий музыкальный директор учреждения,AI
8714,генератор,"машина, преобразующая механическую энергию в электрическую",AI
8715,Бытие,первая книга Моисея,AI
8716,генетика,наука о наследственности,AI
8717,гений,"творческий дух, присущий человеку",AI
8718,генная инженерия,технология изменения/манипуляции наследственным материалом,AI
8719,геолог,"ученый, работающий в геологии",AI
8720,общий зачет,общая классификация в соревновании,AI
8721,половой акт,половая связь с введением эрегированного пениса,AI
8722,ограничение скорости,установление максимальной скорости на дорогах,AI
8723,поправка к закону,изменение закона,AI
8724,манера,способ поведения по отношению к другим,AI
8725,применение насилия,использование насилия,AI
8726,весовая категория,разделение спортсменов по весу,AI
8727,Гибралтар,британская заморская территория на юге Испании,AI
8728,приравнивание,рассмотрение как равнозначного,AI
8729,государство Персидского залива,"страна, расположенная у Персидского залива",AI
8730,горилла,представитель рода человекообразных обезьян,AI
8731,надгробный камень,камень на могиле в память об умерших,AI
8732,граната,снаряд с взрывчаткой и взрывателем,AI
8733,грек,гражданин Греции,AI
8734,фундаментальные исследования,исследования основ без ориентации на практику,AI
8735,закладка камня,торжественное начало строительства,AI
8736,гуляш,"тушеное блюдо с кусочками мяса, сильно приправленное",AI
8737,овес,злаковая культура с рыхлой метелкой,AI
8738,Хайфа,город в Израиле,AI
8739,торговый реестр,публичный реестр зарегистрированных торговцев,AI
