id,translate,translate_description,source
13601,компьютерная симуляция,проведение симуляции с помощью компьютера или компьютерной программы,AI
13602,денди,"мужчина, который демонстративно модно и экстравагантно одет",AI
13603,информационная магистраль,"сеть для быстрой передачи данных, речи, изображения и звука",AI
13604,сеть передачи данных,сеть для передачи данных,AI
13605,псевдоним,"имя, используемое вместо настоящего, чтобы оставаться неузнанным",AI
13606,декодер,устройство для расшифровки/декодирования,AI
13607,дека,приставка СИ для десяти,AI
13608,дельфин,"морское млекопитающее из зубатых китов, живет в стаях и питается рыбой",AI
13609,демократическое движение,"движение, выступающее за демократию",AI
13610,специалист по охране памятников,специалист по сохранению памятников,AI
13611,производное,производное слово,AI
13612,деспот,"глава государства, правящий произвольно и единолично",AI
13613,вопрос по детали,"вопрос, касающийся детали",AI
13614,знание немецкого,(уровень) владения немецким языком,AI
13615,валютные резервы,запас иностранных валют,AI
13616,центр услуг,центр предоставления услуг,AI
13617,служебное право,"право, регулирующее служебные отношения",AI
13618,динар,денежная единица в ряде арабских стран,AI
13619,штука,слово‑замена для забываемого выражения,AI
13620,диоксин,"очень токсичное органическое соединение хлора и углеводорода, образуется как побочный продукт",AI
13621,двигатель с прямым впрыском,"транспорт или мотор, где топливо впрыскивается прямо в цилиндр",AI
13622,прямая инвестиция,непосредственная инвестиция,AI
13623,прямой платеж,платеж без промежуточной стадии,AI
13624,скидка,уценка товара,AI
13625,дискета,круглый магнитный сменный носитель данных в оболочке,AI
13626,дисконт,удержание/сконто; банковский дисконт,AI
13627,дисконтная ставка,процент для дисконта,AI
13628,документационный центр,"учреждение, собирающее и исследующее материалы по теме и открывающее их публике",AI
13629,доломит,порода/минерал доломит,AI
13630,допинговое средство,вещество или метод с эффектом повышения результатов,AI
13631,двойка парная,гоночная лодка для двух гребцов с двумя веслами у каждого,AI
13632,терновый куст,куст или кустарник с шипами,AI
13633,залог за банку,"залог, взимаемый за банки для напитков",AI
13634,съемки,"этап производства фильма, когда ведутся съемки",AI
13635,умерший от наркотиков,"человек, умерший от (чрезмерного) употребления наркотиков",AI
13636,Дрост,фамилия,AI
13637,демпинг,"продажа товаров/услуг по очень низким ценам, чтобы вытеснить конкурентов",AI
13638,демпинговая цена,цена ниже себестоимости,AI
13639,мажор,"лад, характерная черта которого — большая терция к основному тону",AI
13640,угловая точка,угол геометрической фигуры; точка пересечения ребер,AI
13641,прелюбодеяние,вступление во внебрачные отношения,AI
13642,субсидия на жилье,гос. субсидия в Германии на создание собственного жилья,AI
13643,одноактная пьеса,"пьеса, исполняемая в одном акте",AI
13644,партия единого типа,"партия, включающая все лояльные политические течения и подавляющая оппозицию",AI
13645,процесс согласования,процесс достижения соглашения,AI
13646,договор об объединении,договор о соглашении,AI
13647,поход по магазинам,посещение нескольких магазинов ради покупок,AI
13648,потеря дохода,утрата дохода,AI
13649,выпадающие доходы,утрата поступлений денег,AI
13650,рейтинг,"доля зрителей/слушателей, смотрящих определенную передачу",AI
13651,отправитель,"человек, отправляющий что‑то по почте в ответственное место",AI
13652,отправка,процесс отправки чего‑то по почте,AI
13653,запись,исполнение; запись музыки,AI
13654,закон об иммиграции,"закон, регулирующий иммиграцию",AI
13655,возражение,"реакция, в которой выражаются сомнения; возражение",AI
13656,отраслевой профсоюз,профсоюз для одной сферы,AI
13657,ассоциация розничной торговли,объединение розничной торговли,AI
13658,деталь,отдельная часть целого,AI
13659,индивидуальная судьба,особые жизненные обстоятельства одного человека,AI
13660,деталь,"предмет, который нельзя дальше разобрать",AI
13661,индивидуальный зачет,оценка для отдельных лиц,AI
13662,элегия,"стихотворение с грустной, жалобной темой",AI
13663,электронный концерн,крупный производитель электроники,AI
13664,электросмог,искусственно созданное электромагнитное излучение с возможными вредными эффектами,AI
13665,элева,ученик актерской или балетной школы,AI
13666,эльфийка,"женское мифическое существо, похожее на человека",AI
13667,эмигрант,"переселенец, особенно по политическим или религиозным причинам",AI
13668,Эминенция,титул и обращение кардиналов Римско‑католической церкви и некоторых епископов,AI
13669,конец света,"период перед концом человечества, Земли или Вселенной",AI
13670,анкета,"официальный опрос, обследование, исследование",AI
13671,энтузиаст,"человек, испытывающий страстное увлечение чем‑то",AI
13672,волонтер‑помощник,"человек, помогающий в развитии развивающейся страны",AI
13673,наследственный задаток,наследуемая предрасположенность,AI
13674,наследственная субстанция,наследуемый генетический материал,AI
13675,картофель,картофель,AI
13676,жертва землетрясения,"человек, пострадавший от землетрясения",AI
13677,континент,крупная часть поверхности Земли,AI
13678,эмпирическое значение,"приближенное решение, основанное на опыте",AI
13679,шанс на успех,перспектива успеха,AI
13680,требование,условие для выполнения чего‑то,AI
13681,альтернативная касса,альтернативная больничная касса,AI
13682,форма проявления,"форма, в которой что‑то проявляется",AI
13683,застывание,"процесс, при котором что‑то становится неподвижным",AI
13684,цена производителя,"цена, которую производитель требует с покупателя",AI
13685,изделие,результат производственного процесса,AI
13686,пособие по уходу,"гос. поддержка родителю, воспитывающему новорожденного",AI
13687,родительский отпуск,родительский отпуск,AI
13688,эскапада,"адюльтер, авантюрный поступок",AI
13689,этнолог,"ученый, занимающийся этнологией (народоведением)",AI
13690,ограда,"забор, ограничивающий деревню",AI
13691,евхаристическая служба,служба/празднование Евхаристии,AI
13692,страна евро,"государство, принявшее евро как официальную валюту",AI
13693,Европа‑лига,европейский футбольный турнир,AI
13694,евангелист,один из четырех авторов новозаветных Евангелий,AI
13695,исполнительный чиновник,чиновник исполнительной власти,AI
13696,экзот,чужестранец; экзотическая личность,AI
13697,показатель степени,"число, записываемое как показатель степени",AI
13698,экспрессионист,представитель экспрессионизма,AI
13699,экстремист,"человек, действующий крайне; сторонник экстремизма",AI
13700,фабрикант,"человек, производящий или организующий производство в больших масштабах",AI
