id,translate,translate_description,source
3501,Валлис,кантон в Швейцарии,AI
3502,тест товаров,проверка товаров,AI
3503,предупреждающий,"человек, предостерегающий других",AI
3504,техническое обслуживание,меры по проверке и поддержанию,AI
3505,отмена,прекращение существования,AI
3506,Дед Мороз,"персонаж, приносящий подарки на Рождество",AI
3507,винодельня,хозяйство по производству вина,AI
3508,Всемирная организация здравоохранения,подразделение ООН по вопросам здоровья,AI
3509,мировой рейтинг,глобальный список по критериям,AI
3510,космос,пространство за пределами атмосферы,AI
3511,мировой рекорд,лучший результат в мире,AI
3512,оборот,устойчивое выражение с переносным значением,AI
3513,верфь,предприятие по строительству и ремонту судов,AI
3514,ценная бумага,"документ, удостоверяющий право",AI
3515,важность,свойство быть значимым,AI
3516,возобновление,продолжение прерванного действия,AI
3517,возвращение,повторное появление,AI
3518,переизбрание,повторное избрание на должность,AI
3519,винодел,"человек, выращивающий и производящий вино",AI
3520,министерство экономики,ведомство по экономическому развитию,AI
3521,ученый,"ученый (Австрия, Швейцария)",AI
3522,погодные условия,характер погоды за период,AI
3523,вдова,"женщина, потерявшая мужа",AI
3524,дом на колесах,автомобиль с оборудованием для жизни,AI
3525,рынок жилья,совокупность спроса и предложения жилья,AI
3526,йога,философская система с духовными и телесными упражнениями,AI
3527,дефицит времени,давление из‑за нехватки времени,AI
3528,эпохальный перелом,смена исторической эпохи,AI
3529,путешествие во времени,перемещение в прошлое или будущее,AI
3530,журнал,регулярное печатное издание,AI
3531,клетка,наименьшая живая единица организма,AI
3532,свидетельские показания,показания свидетеля,AI
3533,снижение ставок,уменьшение процентных ставок,AI
3534,цирк,зрелищное представление в манеже,AI
3535,привязанность,дружеское или любовное чувство,AI
3536,крах,резкое падение или разрушение,AI
3537,совместная жизнь,жизнь вместе,AI
3538,большинство в две трети,квалифицированное большинство с порогом две трети,AI
3539,команда второй лиги,спортивная команда во второй лиге страны,AI
3540,цикл,регулярное повторение; период полного цикла,AI
3541,"картинка, изображение","нечто, изображенное наглядно, графически, оптическими или электронными средствами или символически, более или менее точная копия реального изображения предметов, людей, ситуаций и т. п.",Ilia
3542,касса перед мероприятием,"касса, где билеты продаются непосредственно перед вечерним мероприятием",Ilia
3543,вылет,предусмотренное расписанием время взлета воздушного судна,Ilia
3544,палата депутатов,совокупность депутатов,Ilia
3545,отводок,"часть или побег растения, из которого может развиться новое растение",Ilia
3546,отклонение,отклонение от направления,Ilia
3547,отправитель,"лицо или учреждение, которое через средство связи отправляет информацию получателю",Ilia
3548,отстранение,снятие человека с должности/поста (обычно против его воли),Ilia
3549,заезд,"небольшое отклонение, экскурсия (например в поездке)",AI
3550,опустившийся,"человек, чей социальный или профессиональный статус снизился или снижается",AI
3551,начальник отдела,"человек, который в учреждении или компании руководит подразделением, отделом",AI
3552,сточные воды,"вода, загрязненная бытовым, коммерческим или промышленным использованием, а также стоки с застроенных или закрепленных поверхностей и непреднамеренный приток посторонней воды",AI
3553,лидер обороны,"защитник, который дает указания другим защитникам",AI
3554,осуществление,деятельность или процесс осуществления; разматывание или снятие с намотанного,AI
3555,пашня,"сельскохозяйственная площадь, регулярно обрабатываемая",AI
3556,администрация,"управление, правительство, исполнительная власть",AI
3557,афганец,гражданин или житель Афганистана,AI
3558,агрессор,"нападающий; тот, кто инициирует конфликт",AI
3559,дело,"сборник записей, связанных по содержанию",AI
3560,план действий,"проработанная концепция, описывающая все меры и порядок действий при большом проекте (катастрофа, ЧС, рекламная кампания)",AI
3561,день акции,день для акции или кампании.,AI
3562,обновление,обновление,AI
3563,акцент,типичная особенность произношения или интонации языка (часто у иностранца),AI
3564,алгоритм,точно описанная процедура решения задачи за конечное число однозначных шагов,AI
3565,самостоятельные действия,осуществление чего-либо без посторонней помощи,AI
3566,горное пастбище,"горное пастбище или луг, где летом ведется выпас и иногда обслуживание/гостеприимство",AI
3567,альфа,первая буква греческого алфавита,AI
3568,возрастная граница,максимально или минимально допустимый возраст (обычно для участия в чем-либо),AI
3569,возрастной класс,группа людей (или других существ) одного возраста/возрастного диапазона,AI
3570,болезнь Альцгеймера,болезнь Альцгеймера,AI
3571,должностное лицо,"лицо, занимающее публичную должность",AI
3572,ана,сборник изречений знаменитых людей,AI
3573,подъезд,путь или маршрут до цели,AI
3574,Анкара,столица Турции.,AI
3575,обвинительное заключение,письменный документ для возбуждения судебного дела,AI
3576,созвучие,ассоциация с похожими звуками,AI
3577,опора,"отношение, при котором кто-то получает поддержку от другой стороны",AI
3578,заметка,"дополнительная информация, данная письменно или устно",AI
3579,сосед,сосед участка или водоема,AI
3580,напряжение,"психическая или физическая нагрузка, приводящая к нервозности",AI
3581,Антарктида,континент вокруг Южного полюса.,AI
3582,антифа,"люди, отвергающие фашизм; в узком смысле — организованные группы",AI
3583,первый визит,первый частный или служебный визит для представления,AI
3584,яблоко,"округлый плод яблони с кожицей, мякотью и семенной коробочкой",AI
3585,аптекарь,специалист по лекарствам; обычно владелец или сотрудник аптеки,AI
3586,аппетит,желание есть,AI
3587,злоба,"злонамеренность, коварство, обман",AI
3588,аргентинец,гражданин Аргентины,AI
3589,аромат,"определенный, обычно приятный запах",AI
3590,процедура убежища,последовательность правовых действий для решения о предоставлении убежища,AI
3591,атомная бомба,"авиационная бомба, использующая энергию ядерного процесса",AI
3592,подъем,"поднимающийся участок дороги, ведущий к чему-либо",AI
3593,наклейка,самоклеящееся изображение любой формы,AI
3594,разъяснение,ответ; объяснение,AI
3595,восстание,часто вооруженное действие сопротивления против существующей власти,AI
3596,надстройка,увеличение здания на один или несколько этажей,AI
3597,лифт,средство для подъема и спуска,AI
3598,подмигивание,краткое закрытие и открытие век,AI
3599,аудитория,зал для мероприятий и собраний (особенно в школах и университетах),AI
3600,эксплуатация,"извлечение выгоды, использование (особенно ресурсов)",AI
3601,оформление,конкретное оформление или выполнение,AI
3602,фрагмент,"вырезанный кусок текста, изображения, фильма или записи",AI
3603,произношение,"акустическое оформление звуков, слов и предложений",AI
3604,место проведения,"место, где проводится и решается соревнование",AI
3605,выезд,процесс выхода из помещения или здания,AI
3606,автономия,право устанавливать собственные законы и жить по ним,AI
3607,автомобильный трафик,"дорожное движение, создаваемое автотранспортом",AI
3608,пекарня,"здание или дом, где выпекают",AI
3609,Бахрейн,островное государство в Персидском заливе.,AI
3610,Баку,столица Азербайджана.,AI
3611,балет,вид сценического искусства и танца,AI
3612,шар,"резиновая оболочка, надуваемая воздухом или гелием",AI
3613,базилика,общественное здание с высоким центральным нефом и боковыми нефами,AI
3614,строитель,"человек, работающий на строительстве",AI
3615,начало строительства,старт работ по проекту,AI
3616,строительная база,место хранения материалов,AI
3617,застройка,процесс застройки территории,AI
3618,приказ,"обязательное распоряжение (в армии, полиции и т. п.)",AI
3619,опрашиваемая,"женщина, которую опрашивают или допрашивают",AI
3620,заключение,результат проверки или теста; отчет специалиста,AI
3621,пособие,дополнительная поддержка деньгами или вещами,AI
3622,вступление,приобретение членства,AI
3623,пользователь,"человек, который использует что-либо",AI
3624,консультационный пункт,"служба, где можно получить консультацию",AI
3625,обогащение,приращение для чего-либо,AI
3626,горняк,"человек, работающий в горной промышленности",AI
3627,альпинист,"человек, поднимающийся в горы",AI
3628,устранение,удаление чего‑либо,AI
3629,осмотр,"событие, когда что‑то детально рассматривают",AI
3630,налогообложение,взимание налогов,AI
3631,рекорд,лучший результат в дисциплине,AI
3632,бета,вторая буква греческого алфавита,AI
3633,затронутость,"состояние, когда что‑то касается кого‑то",AI
3634,мешочек,эластичная сумка для хранения,AI
3635,разрешение,официальное согласие на проект,AI
3636,районное управление,высший орган администрации района,AI
3637,районная администрация,орган общей администрации в Австрии,AI
3638,байк,общее название для велосипеда или мотоцикла,AI
3639,байкер,"человек, который ездит на велосипеде или на мотоцикле",AI
3640,министерство образования,"министерство, отвечающее за вопросы образования",AI
3641,галстук,"элемент одежды, повязываемый вокруг шеи",AI
3642,укус,акт укуса,AI
3643,епархия,административный округ епископа,AI
3644,мочевой пузырь,мочевой пузырь,AI
3645,духовая музыка,"музыкальный стиль или состав, где используются преимущественно духовые инструменты и ударные",AI
3646,облигация,"облигация, ценная бумага",AI
3647,боксер,"человек, занимающийся боксом",AI
3648,бойкот,"организованная изоляция человека, группы, фирмы или страны путем отказа от торговли и политических и социальных контактов, чтобы оказать давление",AI
3649,жареная колбаска,колбаса для жарки или гриля,AI
3650,бригада,"наименьшее крупное соединение сухопутных войск, способное самостоятельно вести бой, обычно состоит из нескольких полков или батальонов и подчинено дивизии",AI
3651,острота,признак большой значимости или опасности,AI
3652,книжная ярмарка,"выставка книг, обычно проходящая регулярно (часто ежегодно)",AI
3653,федеральный министр финансов,руководитель федерального министерства финансов,AI
3654,федеральная столица,"столица государства, состоящего из федеральных земель",AI
3655,федеральная армия,вооруженные силы Австрийской Республики,AI
3656,федеральный кабинет,"совокупность министров правительства, включая канцлера",AI
3657,ведомство федерального канцлера,официальная резиденция и аппарат канцлера,AI
3658,Федеральное ведомство уголовной полиции,"федеральное ведомство по борьбе с преступностью, подчиненное МВД",AI
3659,предвыборная кампания в Бундестаг,агитация партий или кандидатов за голоса избирателей на выборах в Бундестаг,AI
3660,Федеральный административный суд,"высший суд по публично-правовым спорам, не относящимся к конституционным",AI
3661,бункер,бомбоустойчивое убежище для людей и техники,AI
3662,дворецкий,слуга в богатой семье (особенно в Великобритании),AI
3663,кемпинг,"лагерь, ночевка в палатке или жилом прицепе",AI
3664,главврач,руководящий врач больницы или другого медучреждения,AI
3665,христианство,"крупнейшая монотеистическая религия, возникшая на основе учения Иисуса из Назарета",AI
3666,кузен,сын дяди или тети,AI
3667,ЦП,центральный процессор компьютера,AI
3668,крики,"индейский народ, племя на юго‑востоке США",AI
3669,фиаско,"несчастливый, пагубный исход",AI
3670,динозавр,динозавр,AI
3671,деление,процесс деления,AI
3672,документальный фильм,"фильм, правдиво представляющий определенную тему",AI
3673,воздушный змей,неуправляемый летательный аппарат на веревке (игрушка),AI
3674,порыв,"трудно сдерживаемый импульс, сильное стремление",AI
3675,треугольник,"геометрическая фигура, образованная тремя точками, не лежащими на одной прямой",AI
3676,лекарственное сырье,вещество биологического происхождения с лечебным действием,AI
3677,употребление наркотиков,прием (нелегальных) наркотиков,AI
3678,скрытая статистика,"оценочное число случаев, не отраженных в официальной статистике",AI
3679,реализация,достижение намеченного несмотря на препятствия,AI
3680,угловой,"удар с угла поля, когда мяч выбит защитой за лицевую линию вне ворот",AI
3681,Эквадор,государство в Южной Америке,AI
3682,эго,«я»,AI
3683,Эйфель,среднегорье в Германии,AI
3684,автогол,когда игрок забивает в свои ворота,AI
3685,спешка,необходимость срочно что‑то сделать,AI
3686,монтаж,процесс встраивания,AI
3687,включение,включение кого‑то или чего‑то в группу,AI
3688,импорт,ввоз товаров и услуг из‑за границы,AI
3689,вхождение войск,совместное вхождение нескольких людей в здание или территорию,AI
3690,новичок,"человек, который начинает что‑то новое",AI
3691,обрушение,"разрушение, обвал сооружения",AI
3692,одиночный матч,вид игры в теннисе,AI
3693,изгнание,"проживание вне родины, на чужбине",AI
3694,родительский дом,"дом, где человек вырос",AI
3695,родитель,предок первой степени (отец или мать),AI
3696,итоговый эффект,"эффект в конце, в результате",AI
3697,финишный рывок,ускорение в конце дистанции,AI
3698,потребление энергии,"количество энергии, используемой в процессе",AI
3699,командирование,направление одного или нескольких лиц с поручением,AI
3700,разоружение,изъятие или сдача оружия,AI
3701,лишение,"изъятие, отмена разрешения (например лицензии)",AI
3702,изобретатель,"человек, который изобретает",AI
3703,распознавание,распознавание чего‑то,AI
3704,следственный судья,"судья, проверяющий следственные меры прокуратуры",AI
3705,убийство,совершение заранее спланированного убийства,AI
3706,доступность,свойство быть достижимым,AI
3707,Рудные горы,горный массив в Германии и Чехии,AI
3708,Европейский парламент,парламент Европейского союза,AI
3709,эволюция,"медленное, мирное развитие в истории или иных процессах",AI
3710,вечность,очень длительный период,AI
3711,биржа,биржа или обмен (англ.),AI
3712,экземпляр,единичное изделие из ряда одинаковых,AI
3713,экспресс,скорый поезд дальнего следования,AI
3714,экстремизм,крайняя политическая позиция,AI
3715,история семьи,ход развития семьи,AI
3716,семейная жизнь,способ совместной жизни членов семьи,AI
3717,фан‑сообщество,"группа людей, являющихся фанатами чего‑то",AI
3718,мода,мода (англ.),AI
3719,конец рабочего дня,время окончания работы,AI
3720,скала,крупная масса твердой породы,AI
3721,пульт,электрическое устройство для управления на расстоянии,AI
3722,крепость,"сильно укрепленный, военный важный пункт",AI
3723,пожарный,"человек, обученный тушить пожары и спасать людей",AI
3724,фильтр,материал для отделения или выделения веществ,AI
3725,финансовый директор,руководитель финансов,AI
3726,финансовое положение,текущие финансовые обстоятельства,AI
3727,зяблик,представитель семейства вьюрковых,AI
3728,блошиный рынок,"рынок подержанных, часто недорогих товаров",AI
3729,Флоренция,город в Италии,AI
3730,проклятие,сказанное в гневе проклятие,AI
3731,аэродром,место взлета и посадки самолетов,AI
3732,воздушное движение,движение воздушных судов в воздушном пространстве,AI
3733,флаер,"листок с информацией, распространяемый среди людей",AI
